{
  "$schema": "https://json-schema.org/draft/2020-12/schema",
  "$id": "https://dna_design_suite.org/schemas/v1/landscape_query.schema.json",
  "title": "LandscapeQuery",
  "description": "The contract between the search engine and the landscape model (BRIEF-2.2-b). This is the single most load-bearing schema in DNA Design Suite: a breaking change here propagates into the epistatic surface, the burden model, the repair operator and the decision-support layer simultaneously, which is precisely the hazard the planning phase exists to avoid.\n\nTHREE QUERY SHAPES, because one shape cannot serve both the population loop and the coordinate-ascent loop:\n  * `full`        - score a complete sequence. Cost O(L). Used by tier 3 and by final re-ranking.\n  * `delta`       - score a sequence expressed as a base digest plus <=k codon substitutions. Cost O(k*W) for decomposable terms. Used by tier 2 accept/reject.\n  * `delta_table` - return the exact change in every decomposable term for EVERY synonymous alternative at the listed positions. Cost O(|positions| * |Syn| * W). This is the L1 capability of ADR-0002 and it is what makes coordinate ascent affordable; it is also what the repair operator consumes to avoid degrading the objective.\n\nA provider that only implements `full` is legal (capability L0). The search engine degrades to rescoring, which is correct but ~10^3x slower on tier 2; see ADR-0002 for the measured cost model.",
  "type": "object",
  "properties": {
    "schema_version": { "$ref": "common.schema.json#/$defs/SchemaVersion" },
    "contract_major": { "$ref": "common.schema.json#/$defs/ContractMajor" },
    "query_id": { "type": "string", "pattern": "^q_[0-9A-HJKMNP-TV-Z]{26}$" },
    "target": {
      "description": "What to score.",
      "oneOf": [
        {
          "type": "object",
          "title": "FullSequenceTarget",
          "properties": {
            "kind": { "const": "full" },
            "sequence": { "$ref": "sequence.schema.json" },
            "cistron_id": { "type": "string", "description": "Which cistron of the construct context this sequence occupies. Required for multi-cistron constructs so the burden ledger can attribute demand." }
          },
          "required": ["kind", "sequence"],
          "additionalProperties": false
        },
        {
          "type": "object",
          "title": "DeltaTarget",
          "properties": {
            "kind": { "const": "delta" },
            "base_digest": { "$ref": "common.schema.json#/$defs/Sha256Digest", "description": "Digest of the CodonSequence DOCUMENT the provider has already seen in this session — over the document, so two sequences with identical coding regions but different flanks are distinct cache entries, which they must be because flanks change every structure term. If the cache has evicted it, the provider returns status=`error` with code CF-LAND-010 and the caller resends a `full` query." },
            "edits": {
              "type": "array",
              "minItems": 1,
              "maxItems": 256,
              "items": {
                "type": "object",
                "properties": {
                  "codon_index": { "type": "integer", "minimum": 0 },
                  "codon": { "$ref": "common.schema.json#/$defs/Codon" }
                },
                "required": ["codon_index", "codon"],
                "additionalProperties": false
              },
              "description": "Substitutions applied to the base. Providers MUST reject an edit whose codon is not synonymous with the base codon at that index (code CF-SEQ-004) - this is where invariant I3 is defended at the contract level rather than by convention."
            },
            "cistron_id": { "type": "string" }
          },
          "required": ["kind", "base_digest", "edits"],
          "additionalProperties": false
        },
        {
          "type": "object",
          "title": "DeltaTableTarget",
          "properties": {
            "kind": { "const": "delta_table" },
            "base_digest": { "$ref": "common.schema.json#/$defs/Sha256Digest" },
            "positions": {
              "type": "array",
              "items": { "type": "integer", "minimum": 0 },
              "minItems": 1,
              "description": "Codon indices to expand. Omitting a position from this list is how the caller excludes locked codons."
            },
            "cistron_id": { "type": "string" }
          },
          "required": ["kind", "base_digest", "positions"],
          "additionalProperties": false
        }
      ]
    },
    "host_context": {
      "type": "object",
      "description": "Which host, in which physiological state. Separated from construct context because one construct may be scored against several hosts in a portability analysis.",
      "properties": {
        "host_id": { "$ref": "common.schema.json#/$defs/HostId" },
        "host_profile_digest": { "$ref": "common.schema.json#/$defs/Sha256Digest", "description": "Pins the exact HostProfile document. Required for reproducibility: tRNA tables get corrected over time." },
        "condition": { "$ref": "common.schema.json#/$defs/GrowthCondition" }
      },
      "required": ["host_id", "host_profile_digest"],
      "additionalProperties": false
    },
    "construct_context": {
      "description": "The construct the sequence sits in. Inline for one-shot library use, by digest for job execution (the orchestrator uploads it once).",
      "oneOf": [
        { "$ref": "construct_context.schema.json" },
        {
          "type": "object",
          "properties": {
            "kind": { "const": "ref" },
            "construct_digest": { "$ref": "common.schema.json#/$defs/Sha256Digest" }
          },
          "required": ["kind", "construct_digest"],
          "additionalProperties": false
        }
      ]
    },
    "requested_terms": {
      "type": "array",
      "items": { "$ref": "common.schema.json#/$defs/TermId" },
      "minItems": 1,
      "description": "Explicit term list. A wildcard is deliberately NOT supported: a job whose objective set depends on which predictors happen to be installed is not reproducible."
    },
    "outputs": {
      "type": "object",
      "description": "Which output blocks to populate. Requesting less is how tier 1 and tier 2 stay cheap.",
      "properties": {
        "scalars": { "type": "boolean", "default": true },
        "per_position": { "type": "boolean", "default": false, "description": "Per-codon diagnostic tracks. Cost is O(L) memory per term; only the decision-support layer requests these, once per surviving candidate." },
        "deltas": { "type": "boolean", "default": false, "description": "Only meaningful with a delta_table target." },
        "gradients": { "type": "boolean", "default": false, "description": "L2 capability. Gradient w.r.t. relaxed codon logits; see ADR-0002 for why this is optional and rarely used." },
        "uncertainty": { "type": "boolean", "default": false },
        "violations": { "type": "boolean", "default": false }
      },
      "additionalProperties": false
    },
    "budget": {
      "type": "object",
      "properties": {
        "tier": { "$ref": "common.schema.json#/$defs/BudgetTier" },
        "max_latency_ms": { "type": "integer", "minimum": 0, "description": "Soft deadline. A provider that cannot meet it returns status=`partial` with the terms it did compute rather than blocking - the search engine treats a missing term as `unknown` and defers the candidate to the next generation." },
        "max_memory_mb": { "type": "integer", "minimum": 1 }
      },
      "required": ["tier"],
      "additionalProperties": false
    },
    "cache_policy": {
      "type": "object",
      "properties": {
        "read": { "type": "boolean", "default": true },
        "write": { "type": "boolean", "default": true },
        "namespace": { "type": "string", "description": "Cache partition. Defaults to the landscape lockfile digest, which makes cross-job contamination between different model versions structurally impossible." }
      },
      "additionalProperties": false
    },
    "model_pins": {
      "type": "object",
      "description": "Optional per-term artifact pin, the highest rung of the ADR-0009 resolution ladder. The orchestrator populates this from the job's landscape lockfile so that every query in a job resolves identically even if a channel moves mid-job.",
      "propertyNames": { "$ref": "common.schema.json#/$defs/TermId" },
      "additionalProperties": {
        "type": "object",
        "properties": {
          "artifact_id": { "$ref": "common.schema.json#/$defs/ArtifactId" },
          "digest": { "$ref": "common.schema.json#/$defs/Sha256Digest" }
        },
        "required": ["artifact_id", "digest"],
        "additionalProperties": false
      }
    },
    "seed": { "type": "integer", "minimum": 0, "description": "RNG stream seed for stochastic predictors (MC dropout, sampled ensembles). Required whenever `uncertainty` is requested with a sampling method, otherwise results are not replayable." }
  },
  "required": ["schema_version", "contract_major", "query_id", "target", "host_context", "requested_terms", "budget"],
  "additionalProperties": false
}
